,created_utc,title,selftext,score,upvote_ratio,num_comments,subreddit
331,1606570722.0,Doctoral Research on Sleep and Smartphone Use with Fitness Enthusiasts Aged 18-24,"Hi guys. Our sincere thanks to those who have already contributed to our research! Our Ph.D team at the University of Limerick, Ireland, are exploring the sleep patterns and smartphone usage of fitness enthusiasts aged 18-24. We are particularly interested in hearing from users of devices with sleep tracking capability (e.g. Fitbit, Garmin). If you would like to contribute to this study, please click on the link below to complete a 15-minute questionnaire. Thanks so much for your time guys!

[https://micquality.qualtrics.com/jfe/form/SV\_bJX3oVH6i9V4UxT](https://micquality.qualtrics.com/jfe/form/SV_bJX3oVH6i9V4UxT)

Information on the background to this study is available in this paper which we published in early 2020:

Mac Cárthaigh, S., Griffin, C., & Perry, J. (2020). The relationship between sleep and problematic smartphone use among adolescents: A systematic review. *Developmental Review*, *55*, 100897.",5,1.0,0,marathons
332,1605929185.0,Beginner questions,"I'm 25. Used to run xc and track. Just starting up 7 years after being out of running. Very excited. Starting with 1-2 mile jogs 2x a day. And some cross training skate and surf.


Really want to swim and bike too to keep active. I'm a heavy foot and when I was active in high school I always hurt myself and over worked out/under trained.


Goals: run a marathon in the next year
Sub 19 5k
Sub 5 min mile



I have a 5k scheduled 3 months from now but I'm researching marathon training because I would feel amazed at running and completing a marathon.


I plan on just jogging twice a day for the first month. Then some interval training a long with stride work.

I really want to do some distance and high mileage. I'm very fast at sprinting for someone who doesn't run much so I don't want speed I want endurance.


Any advice for a goal set. Maybe positive support.
I'm taking it easy. I'm only running at 50% of my energy conserving it for my next run. Keeping positive vibes and happiness instead of stressing about extra mileage or speed yet I'm only one week in to running.",3,0.72,5,marathons
333,1605114381.0,There is actually a marathon in the desert..,,3,1.0,5,marathons
334,1604542018.0,QUESTION: Just ran a marathon and my outside of my foot hurts! What the diagnosis?,"Hi, 
I ran a marathon last Saturday then on Tuesday the outside of my right foot started to hurt every time I put pressure on it when I walked. I gave it another day to see if it was serious and the next morning I went to the health center. They said they thought it was plantar fasciitis and that I should walk a little bit and stretch to get my tendons stretched out. The pain goes from the outside of my foot back to my heel. I don’t know whether it could be a stress fracture or plantar fasciitis but since there are different treatments for both injuries I wanted to see your opinion. 


Thanks!",2,0.6,5,marathons
335,1604172925.0,UPDATE Sixteen year old wanting to run marathon in four weeks. I did it sort of.,"Hello,
Over the summer I asked this community with her running a marathon with four weeks of preparation was a good idea. The responses I received were a mix. Some said that I was killing myself and that I need the full 12 to 16 weeks to be able to accomplish such a venture. Some said that I was OK. Some said I didn’t need four weeks And that it was going to suck but I could do it any day.

I ended up preparing during the month to do the marathon. I unfortunately got shinsplints and decided not to proceed with my training. After reading David Goggins book however I was inspired again to attempt to run a marathon. I set the date two weeks in advance and one week later went on a run on my track where I was going to attempt the run. I ran for an hour and decided that it would be manageable to do for more of them. A.k.a. run a marathon. Today I did it. I ran 26.45 miles in under four hours and 20 minutes. Well my body does not feel good and the run was not easy I did it and hope to live another day. In my previous post someone asked me to update them on what I ended up deciding to do. I wanted to tell my story both as inspiration for others who want to run a marathon and to talk about an experience that was pretty life-changing for me.

Thanks",10,0.86,5,marathons
336,1603987217.0,"Happy Cakeday, r/marathons! Today you're 7","Let's look back at some memorable moments and interesting insights from last year.

**Your top 10 posts:**

* ""[Long time lurker, first time FINISHER](https://i.redd.it/ey3u3hglv3241.jpg)"" by [u/nsweeney11](https://www.reddit.com/user/nsweeney11)
* ""[I honestly don't know what I'm going to talk about next year...](https://i.redd.it/5hh4o9bk08d51.jpg)"" by [u/anotherhydrahead](https://www.reddit.com/user/anotherhydrahead)
* ""[Runners change their route to high five a sweet old lady who's watching the marathon.](https://v.redd.it/ulim53xyjg041)"" by [u/kreiast](https://www.reddit.com/user/kreiast)
* ""[My first half marathon. I only had seven weeks to prepare and my goal was to finish it before the two hour mark. Mission accomplished!](https://i.redd.it/etvngfyg6zj51.jpg)"" by [u/H3LL0FRI3ND\_exe\_file](https://www.reddit.com/user/H3LL0FRI3ND_exe_file)
* ""[Ran my first 42km marathon](/r/marathons/comments/f1ngev/ran_my_first_42km_marathon/)"" by [u/cykablyath](https://www.reddit.com/user/cykablyath)
* ""[Dr. Anthony Fauci's Guide to Jogging During a Pandemic](https://youtu.be/UvDhdBLgItg)"" by [u/anotherhydrahead](https://www.reddit.com/user/anotherhydrahead)
* ""[The story of how I managed to run a sub 3 hours marathon in 2019 alongside my training for UTMB, including training plan, training log and all 3 attempts to actually do it!](https://link.medium.com/DALc0J9ER2)"" by [u/aldawoudy](https://www.reddit.com/user/aldawoudy)
* ""[New York City Marathon Fun Fact: There are 1579 porta potties at the Start Line this year.](/r/marathons/comments/dqs39l/new_york_city_marathon_fun_fact_there_are_1579/)"" by [u/mouseycatt](https://www.reddit.com/user/mouseycatt)
* ""[The various types of runner to offer water to.](https://imgur.com/gallery/jLVsQ2L)"" by [u/anotherhydrahead](https://www.reddit.com/user/anotherhydrahead)
* ""[Ooooooh it's marathon season (kind of?) - who's targeting sub three??](/r/marathons/comments/isv87s/ooooooh_its_marathon_season_kind_of_whos/)"" by [u/danfutrell](https://www.reddit.com/user/danfutrell)",6,1.0,0,marathons
337,1603313551.0,Are there any London 2020 marathon runners here?,Was wondering what was in the Virtual marathon medals parcel. What came other than the medal and T-shirt?,3,1.0,3,marathons
338,1602420007.0,Would you run a marathon in Kansas right now?,,4,1.0,3,marathons
339,1602335775.0,The Worst Olympic Marathon in History,,8,1.0,1,marathons
340,1601905602.0,"I will be running my first marathon on March 21st of 2021 and I will be running it for a foundation that supports ALS research. I have a goal of $1,000 and need your help!","This year, I'll be attempting to become an Iron Phi - a distinction given to a small percentage of members within my Fraternity. The mission of Iron Phi is to strengthen the Phi Delta Theta International Fraternity and the impact it has on the fight against Lou Gehrig's disease through the fundraising and athletic efforts of its members. Lou Gehrig was a member of Phi Delta Theta, and our organization has taken an active role in finding a cure.

The net proceeds will support ALS (Lou Gehrig's disease) research, education, screening and treatment. It will also help strengthen an organization (Phi Delta Theta) that has had a lasting impact on my life.

On March 21st of 2021 I will set out to achieve a goal of mine that I've had for a long time, and that is to run a full marathon. As COVID-19 has affected our world, I will be attempting my marathon completly on a treadmill. Not only will this challenge me physically, but it will also be a great mental challenge to overcome. The past two years I have become an avid runner, but I have never faced a challenge this big before. I have always liked to challenge and push myself to be my absolute best, so I will be training diligently months in advance for my marathon. I know my competitive drive will push me to complete the full 26.22 miles at a respectable pace. With that being said, I would like to thank everyone in advance for their generosity and support. I look foward to the run and supporting the ALS association to help find a cure. Thank you so much.

I'm going to dedicate this run to my great grandmother. Although she did not pass away from ALS, I am still going to hold her in my heart on March 21st. She wanted so bad to see me grow up into the man I am today, and I know raising this money for ALS would have made her proud. On March 21st I hope she will be looking down on me as I pass the 26 mile threshold.

Approximately 5,600 people in the U.S. are diagnosed with ALS each year. It is a progressive neurodegenerative disease that affects nerve cells in the brain and the spinal cord. Motor neurons reach from the brain to the spinal cord and from the spinal cord to the muscles throughout the body. The progressive degeneration of the motor neurons in ALS eventually leads to their death. That's why I'm becoming an Iron Phi. To do something bold about Lou Gehrig's disease.

I've set my personal goal at $1,000. So I need your help. You can make a donation by going to the pasted link below and clicking on the ""Make a Gift"" link below the thermometer.
I hope that you'll share this incredible adventure with me - by supporting me in my fundraising efforts.

Thank you in advance for your generosity!

Sincerely,
Kyle Lawson

[Iron Phi](http://support.ironphi.org/site/TR/Events/General?px=1140282&pg=personal&fr_id=1040)",6,0.75,0,marathons
341,1601811249.0,Kipchoege took the 'L' in London 2020," Kipchoge seemed like the only man in history to  not have an off day in any marathon. Good to see he is actually human.  Whatever was bothering him, it is commendable to see him bring it home  in 8th.",8,1.0,1,marathons
342,1601764619.0,London Virtual.,Good luck yo my fellow runners of the Virtual London 'My Way' Marathon. If I see any of you in Westminster I'll give you a wave.,4,0.84,1,marathons
343,1601151423.0,Pre-race Routines,"I’m a week out from my first marathon (virtual Twin Cities) and I’ve got my morning routine down pat. Just curious as everyone is a little different, what’s your routine?",7,1.0,1,marathons
344,1600799402.0,Ph.D Research on Sleep and Smartphone Use with Fitness Enthusiasts Aged 18-24,"Hi guys. Our sincere thanks to those who have already contributed to our research! Our Ph.D team at the University of Limerick, Ireland, are exploring the sleep patterns and smartphone usage of fitness enthusiasts aged 18-24. We are particularly interested in hearing from users of devices with sleep tracking capability (e.g. Fitbit, Garmin). If you would like to contribute to this study, please click on the link below to complete a 15-minute questionnaire. Thanks so much for your time guys!

[https://micquality.qualtrics.com/jfe/form/SV\_bJX3oVH6i9V4UxT](https://micquality.qualtrics.com/jfe/form/SV_bJX3oVH6i9V4UxT)

Information on the background to this study is available in this paper which we published in early 2020:

Mac Cárthaigh, S., Griffin, C., & Perry, J. (2020). The relationship between sleep and problematic smartphone use among adolescents: A systematic review. *Developmental Review*, *55*, 100897.",4,0.84,0,marathons
345,1600120890.0,Ooooooh it's marathon season (kind of?) - who's targeting sub three??,"Started a Strava community to get together a bunch of runners who've run sub 3 hours or who are currently targeting it this Fall or next Spring. This group is a supportive group to inspire and encourage each other through training as we all work towards a pretty tough goal. Join us! What are you doing to get to that level? How are you training? What's your mileage like? How long have you been trying to get there?

[www.subthree.org](http://subthree.org)",13,0.89,4,marathons
346,1600013171.0,Fair on the Square: Marathon Debut and Victory,,1,1.0,0,marathons
347,1599508896.0,"Virtual 2020 Boston Marathon Begins Saturday, CBSN Boston Coverage",,6,1.0,0,marathons
348,1599364387.0,Difficulty during runs,"I am training for a full marathon which I plan to run in January. My longest run till date is a 16 km run. I run 5 times a week. Yesterday I was planning to run  9 km . I have run this distance many times before. Yesterday around the 6th kilometer I started experiencing a really sharp pain near the upper right part of my stomach right next to the upper abs. I tried taking deep breaths in and slowing my speed down but the pain persisted and I had to stop. This has never happened before. The things that I did differently before this run were that I went out a bit fast in the first three kilometers.
(Usually my pace for the first 3 km is 5:15 min/km but yesterday I ran them at 5 min/km pace ) 
Also I did a core work out the day  before yesterdays run. All the rest of the conditions were the same.
I do not know what went wrong . Was it the pace or something else.Could you let me know if anything like this has happened with you?. what could be the reason behind it?. How could I improve myself so that it doesn't happen again. Any specific workout , exercise ,stretch ,diet that I should do in order to make sure it doesn't happen again.?",3,0.8,7,marathons
349,1599311341.0,Ph.D Research on Sleep and Smartphone Use with Fitness Enthusiasts Aged 18-24,"Hi guys. We're really grateful to those who have already contributed to our research! Our Ph.D team at the University of Limerick, Ireland, are exploring the sleep patterns and smartphone usage of fitness enthusiasts aged 18-24. We are particularly interested in hearing from users of devices with sleep tracking capability (e.g. Fitbit, Garmin). If you would like to contribute to this study, please click on the link below to complete a 15-minute questionnaire. Thanks so much for your time guys!

[https://micquality.qualtrics.com/jfe/form/SV\_bJX3oVH6i9V4UxT](https://micquality.qualtrics.com/jfe/form/SV_bJX3oVH6i9V4UxT)

Information on the background to this study is available in this paper which we published in early 2020:

Mac Cárthaigh, S., Griffin, C., & Perry, J. (2020). The relationship between sleep and problematic smartphone use among adolescents: A systematic review. *Developmental Review*, *55*, 100897.",5,1.0,0,marathons
350,1599022078.0,Sub-3 hour marathoners - join a community of runners with the same goal!,"Running friends - 

I ran a track marathon in May in my lifelong effort to run a sub 3 hour marathon, and ended up running 2:58:50 in 105.5 laps (you can read my report [here](https://www.reddit.com/r/AdvancedRunning/comments/gr9s12/i_just_ran_a_marathon_on_a_400_meter_track_1055/)). While I consider this a PR since it was done on a track, I still want to prove myself in a race and think I can still shave a couple minutes off this time. I recently found an in-person race (in a socially distanced, time trial format with runners starting every 10 seconds and sequenced with fastest-first) in November that I'm going to use to make another run at a sub-3 effort. I was thinking it would be fun to get a bunch of runners together (virtually) who are also training towards a sub 3 hour marathon in a strava group. Anyone want to join me in this group ([www.subthree.org](http://subthree.org)).

Misery loves company. :) Join me! Seeing everyone else out there with the same goal is motivating.  
Dan",5,0.69,0,marathons
351,1598808484.0,The various types of runner to offer water to.,,15,1.0,3,marathons
352,1598721553.0,My first half marathon. I only had seven weeks to prepare and my goal was to finish it before the two hour mark. Mission accomplished!,,39,0.97,5,marathons
353,1598576638.0,Upper Thigh Pain,"Hey all, hoping for a little group think on an nagging injury.

I’m 5 weeks away from my first marathon and training is going relatively well. Hitting my bench marks, yasso 800s a few weeks ago went well. On target for my goal pace, 8:20-8:30 splits. However over the last 3 weeks I’ve developed quite a bit of pain in my lower left thigh. At first I attributed it to shoes (Brooks Adrenaline GTS 20). I’m a large/lean runner, 6’6” 190ish and was up to around 360 miles on them. I’ve got a new pair, same brand/model with new insoles (Currex High Profile) and the first week in them was fantastic, little to no pain. Even turned in an 8 mile run in 60 mins. 

Things have changed this week though. I ran a long 15 on Sunday, recovered Monday, 40 min easy run on Tuesday, 50 min easy run Wednesday, and today (Thursday) was meant to be 3x3 mile repeat tempos at goal pace. The pain was there the entire time, so much so that I gave up a mile into the second tempo. The pain isn’t muscle related as my quads feel fine. I’ve got a theragun and use it regularly. I realize this is rather vague but I’m just trying to get an idea of how serious this is and if I should take significant time off.",5,1.0,11,marathons
354,1598447954.0,Virtual Running Challenges App Feedback,,1,1.0,0,marathons
355,1598394034.0,This nun ran a marathon on a treadmill to benefit a food pantry,,10,1.0,2,marathons
356,1598086717.0,"London Marathon 1981 RARE HOME MOVIE Rotherhithe, Bermondsey SE16 area",,10,1.0,1,marathons
357,1598032428.0,Ph.D Research on Sleep Patterns and Smartphone Usage with Fitness Enthusiasts Aged 18-24,"Hi guys. Thanks so much for those of you who have already participated in our research! Our Ph.D team at the University of Limerick, Ireland, are exploring the sleep patterns and smartphone usage of fitness enthusiasts aged 18-24. We are particularly interested in hearing from people who use fitness trackers with sleep tracking capability (Fitbit, Garmin, etc.). However, ownership of these devices is not a requirement! If you would like to contribute to this study, please click on the link below to complete a 15-minute questionnaire.

Full details of the study objectives are provided in the participant information sheet. Thanks so much for your time guys!

[https://micquality.eu.qualtrics.com/jfe/form/SV\_bJX3oVH6i9V4UxT](https://micquality.eu.qualtrics.com/jfe/form/SV_bJX3oVH6i9V4UxT)",7,0.9,0,marathons
358,1597705101.0,Dr. Anthony Fauci's Guide to Jogging During a Pandemic,,16,0.95,0,marathons
359,1597491708.0,COVID-19 Update | VCU Health Richmond Marathon,,2,1.0,0,marathons
360,1597441645.0,Ph.D research on sleep and smartphone usage with fitness enthusiasts aged 18-24,"Hi guys. Our Ph.D team at the University of Limerick, Ireland, are exploring the sleep patterns and smartphone usage of people aged 18-24. We are particularly interested in hearing from people who use fitness trackers with sleep tracking capability (Fitbit, Garmin, etc.). However, ownership of these devices is not a requirement! If you would like to contribute to this study, please click on the link below to complete a 15-minute questionnaire.

Full details of the study objectives are provided in the participant information sheet. Thanks so much for your time guys!

https://micquality.eu.qualtrics.com/jfe/form/SV_bJX3oVH6i9V4UxT",5,1.0,0,marathons
361,1596919488.0,I recently found my runners high. Found this 90 second podcast about marathons. Thought i'd share :),,6,0.8,2,marathons
362,1596755352.0,The DICK'S Sporting Goods Pittsburgh Marathon,,1,1.0,0,marathons
363,1596610843.0,"A video to show you what I do before a hard running workout or race. Drills and strides are amazing for your coordination, form and to prime you for a good run. I hope this video helps but if you have any questions, just let me know.",,8,1.0,0,marathons
364,1596514227.0,Tips for running my first small marathon?,"Im 21F about 212 lbs and i want to run a small marathon October 2020. Just five miles, but I’ve never tried to do something like this before, and I wanna try it. I have mild asthma and broke my leg last year, so wanna do this as a testament to getting over my injury kinda. How should I get started? Is the best way to train to just like, run? I have no clue, I’ve never ran really. So thought I’d ask for tips here.

Edit: I guess I should clarify, it’ll be a 5 mile marathon, goes to show I know nothing about marathons 😅",1,0.6,10,marathons
365,1596351611.0,"My Running Motivation series continues with the fantastic Emma Joy, who writes her lipstickandtrainers.com. Emma is a personal trainer, coach and sub 4 hour Marathon runner. She has a great personality and as her blog implies, lipstick and trainers dont have to be mutually exclusive.",,0,0.33,2,marathons
366,1596245742.0,What’s the longest distance you run at once before a marathon?,I’ve read that being able to run 18 miles is ideal to run in one go near the end of your training. Just looking for averages! I’m running my first one in May.,4,1.0,15,marathons
367,1595945013.0,16 year old wanting to run a marathon in 4 weeks,I ran a half marathon in 2:00 a couple of weeks ago and regularly do 9 miles. I’m sixteen but believe if I train in these 4 weeks I can run a marathon. Is this idea stupid?,7,0.9,9,marathons
368,1595887560.0,Virtual marathons,"How do you feel about virtual marathons? They are growing on me. I can do multiple ones a year, get a medal, most have app support and a community presence base",4,0.84,1,marathons
369,1595851218.0,Beer Marathon 2020,,2,1.0,0,marathons
370,1595777602.0,I honestly don't know what I'm going to talk about next year...,,62,0.97,0,marathons
371,1595777488.0,The Detroit Free Press/TCF Bank Marathon Has Gone Virtual,,1,1.0,0,marathons
372,1595472632.0,10 Highly Motivating Quotes By David Goggins,,1,1.0,0,marathons
373,1595452142.0,"Not many marathons happening at the moment, but I did find some footage of the time we attempted one as a 3-legged race.",,11,0.93,2,marathons
374,1595364847.0,The 2020 MCM Weekend is Officially Virtual-Only,,2,1.0,1,marathons
375,1595038128.0,"Camp Chaski (Virtual Running Camp feat. Fauble, Hall, Enfield, Bruce, Stinson, et al) - Pay What You Can/Free Entry","Hey Reddit Runners - no catch here, I just want to share some good will during COVID times in a cool community of fellow runners. Mods - if you feel this is inappropriate, feel free to remove.

We're giving folks the option to choose any price that works for you (including 100% free: $75, $50, $25, or 0$ if you don't have any room in your budget) and we'll make you a custom code no questions asked.

We think we've put together something awesome and that the $119 list price is fair for some, but we want to make it available to as much of the running world as we can and we know that people are in very different boats right now financially.

Full disclosure - this virtual camp put on by my coaching collective and we do normally charge for it, but this is really just me as a human offering good-will to the reddit running world.

Camp starts next week and is all virtual. It'll feature morning guided workouts (both running and supplemental) and afternoon interactive masterclasses by some big name folks like Steph Bruce, Parker Stinson, Emily Infield, Scott Fauble, Marielle Hall, Becky Bruce and (though I don't consider myself a big name), me.

Everything will also be recorded if you can't come live.

Full deets are here: [chaski.run/camp-road](https://chaski.run/camp-road)

&#x200B;

DM/Chat/Comment if you want to come - can't wait to see you next week!

Love,

Ty",8,1.0,6,marathons
376,1581323195.0,Ran my first 42km marathon,"

I completed in 4hrs 32minutes which is good enough  for a starter.

I signed up for the marathon  immediately after my 18th birthday (age limit for my country). The marathon was 3 weeks away and I had never run a long distance race, even though I regularly play basketball and a couple of other sports I had to train my ass off for this. 

I ran this marathon for many reasons. Firstly, for a friend who is battling her mental health issues. Secondly, to get out of the stupid analysis paralysis cycle I had gone into, I just went for the bulls eye. Thirdly, to understand that we are much bigger than what we think we are: our insecurities and the society oppress us, limit us by treating everyone the same but aren’t we all just special in our own ways? And lastly but most importantly: to seek discomfort, the cave you fear to enter holds the treasure you want to seek ~ Joeshp Campbell.

My body broke down after 21km and I could  barely run I wanted to quit but you gotta keep telling yourself that the pain is temporary but the pride is forever. 
Irony: I can barely walk now. my legs hurt so much :3",23,0.91,8,marathons
377,1581079808.0,Korona Maratonow Wyszehradu,,0,0.5,0,marathons
378,1580992972.0,Cheating in Mass Participation Running Survey,"Hi all, hope I’m ok to post this here.

For my final year dissertation project at university, I’m exploring cheating in mass participation running events (marathons, parkrun, fun runs etc.). I have created an online survey and my aim is to get 500 participants. So far, I’m halfway to this total.

The survey is approximately 10 minutes to complete, if anyone would like to complete it, I would massively appreciate the support.

[https://ntusurvey.onlinesurveys.ac.uk/cheating-in-mass-participation-running](https://ntusurvey.onlinesurveys.ac.uk/cheating-in-mass-participation-running)  

Thanks.",10,0.87,8,marathons
