,created_utc,title,selftext,score,upvote_ratio,num_comments,subreddit
155,1659089542.0,52 marathons in 52 weeks,"Hi all, I am currently in the process of running 52 marathons in 52 weeks in 2022 for a children’s charity – Get Kids Going.
 
So far, I’m 30 marathons in and I can safely say I need some help.
 
What I’ve learned is this is by far the most mentally challenging thing I’ve ever tried. Purely because it is relentless from a running stand point, diluted recovery period and (of course!) the length of a marathon run. Then trying to fit it around living a normal everyday life and a 9-5 job! Some of the runs lately I’ve had to get up at 3:30am and do before work which genuinely makes me feel psychotic!!
 
Having run 9 marathon before this year, my recovery afterwards was always poor and it would be 2-3 weeks before I could run again. So to say the start of the year was rough would be an understatement. The runs were taking me over 5 hours for the first month or so before my recovery became a lot shorter. I started to find my body was returning to normal within 1-2 days which was a win so I could focus the rest of the lead up to the next run on getting ready for it.
 
In saying that…I have never been one for focusing on nutrition (other than the obvious carb load the day before and protein shakes straight after a run) or a proper recovery session (stretching, slow run etc).
 
Things started to change during marathons 14 and 15 as I ran Manchester and Brighton in back to back weeks at a 3 hours 45 minute pace (5 seconds a part in official timings) – taking nearly 40 minutes off my previous best. That shows the fitness improvements but it also shows how you can really push yourself when running a race with a crowd, support and more mental energy.
 
Straight after that I had such a dip…I didn’t want to do the runs. Mentally I was in a bad place at certain points towards the back end and physically my legs were cramping, bad stitches and more.
 
20 marathons in I launched my fundraiser and became accountable for things setting a £5.2k target to raise which is actually very tough based on previous experiences. BUT since then I’ve been able to focus more during runs as its now something people know I’m trying to achieve for a charitable cause.
 
Now comes where I’m currently at…30 marathons in…and I need help. Despite what I’ve learnt in terms of coping with bad phases of running, overcoming mental blocks and getting in a rhythm of doing a marathon a week. I can’t continue doing this on my own so I’ve seeked a coach to help towards the following:
 
Nutrition throughout my week
Recovery
In running pacing and hydration
 
AND…probably the craziest and most backwards thing of all of this…how I can get my marathon time down for London 2022. God knows what this will entail!!
 
Quite honestly I’m scarred of the load this is going to bring but willing to give it a go as like I say I do need help now.
 
If anyone has done something similar or has any ideas on generating bigger contributions towards the charity fundraising side of things, please let me know any tips!",16,1.0,6,marathons
156,1659088345.0,first timer needs help,I'm 14 years old and trying to prepare for an 11 km run for a school event in 16 days and I have never tried running long distances. Any tips for preparation? I'm more or less an average teen although I've had experience in being a swimming athlete and I've been lifting weights for 5 or 6 months.,2,0.75,7,marathons
157,1658506187.0,Hitting a wall in training for first marathon,"I’m currently training for my first full marathon in October.  Before “officially” training I had been running probably 20-25 miles per week with 6 generally being the longest.

I was a couple months in and everything was going great.  No pain, no burnout.  Then my dog of 13 years had to be put to sleep suddenly about 3 weeks ago.  I was in a really bad place but kept with the program I’ve been doing, hating most of it.  Then a couple days later I got sick.  Still kept with the program.  Then 2 weeks ago I had my log run of 15 miles and my knee started hurting toward the outer edge of the area below the kneecap in the last 3/4 mile or so.

I kept with the program the following week, but every run, even at 5 miles, was a struggle.  My perceived effort was through the roof and my heart rate was way higher than normal for my normal pace.  Then my knee started hurting again at the end of a Friday 5 miler so I finally decided to just shut it down for a week, so I missed my 16 mile long run last week.

I finally went out for a short 5k today and my knee started hurting again after only one mile.  I’m supposed to do 17 on Sunday but now I’m doubting that will happen.  

I’m starting to just get very stressed that I’m falling too far behind coming up on 2 months out.  This is my first time so I really don’t know what to do at this point.  Any advice would be greatly appreciated.",1,0.67,10,marathons
158,1658449286.0,summer travel killed my endurance!,"I work in the schools, so I get the summers ""off.""  I'm training for my third marathon.   I'm 45.  So I was essentially on vacation for about 4 weeks this summer, missed four long runs on my training schedule, and didn't get much running in at all, though I did a bunch of hiking.   In any case, marathon is October 1 and I'm behind the eight ball on my distance and endurance.  I live in southern Utah, so this morning, for example, at 6 am, it was already 84 degrees.  I try to get my runs started before the sun goes down, but this isn't always possible b/c I have a family to feed and a dog to walk every morning.   I'm wary of pushing myself too hard in the heat, and have been hydrating more.  I can run 6-7 miles pretty comfortably, but in some regards, I feel like I've lost a lot of ground, and I'm concerned about getting back up to where I need to be in my training.  (I'm using the Hal Higdon Novice 2 training schedule.)  

TIA for suggestions/advice/empathy!",2,1.0,3,marathons
159,1658290298.0,Run Tracking- Which is More Accurate,,2,0.75,4,marathons
160,1658193225.0,Marathon Training Plan for Experienced Runners,"Hi everyone - looking to (hopefully) get some advice. I’ve been running for many years at this point. Took a hiatus when I went to college in 2017, picked it back up in 2020 during Covid and have kept up with it ever since. I run about 10 miles a day without much challenge. I finally decided to pull the trigger and sign up for a marathon in November. My problem is that while it’s my first marathon, I am not new to running and already have a great endurance built up. I’m wondering if anyone can recommend a marathon training regiment that isn’t for beginners but also is not for well-versed marathon runners - ideally, something in the middle. Any and all input is greatly appreciated!",3,1.0,7,marathons
161,1657773242.0,Need advice on first time marathon. Less than 15 weeks to go!!,,4,1.0,11,marathons
162,1657389152.0,Should I be strength training while preparing for a marathon?,"I’m looking into running the Houston Marathon in January 2023. Should I be complementing my running program with a strengthening program? 

If so does anyone have a resource for example programs or a program they really liked?",3,1.0,6,marathons
163,1657298413.0,My 68 y.o Dad is preparing for a 5k September. Tips?,"Hey yall,

My 68 y.o old Dad is running a 5k this September. He does aerobics 3+ times a week (indoor sit back cycle and elliptical) so he has somewhat of an aerobic base. His goal is to finish the run without stopping. Any training regimens and or tips yall can recommend so that he can achieve his goal?",4,1.0,4,marathons
164,1657282939.0,Recovering from Covid-19... should I be running again so soon,"Good morning.  I am new to the sport.  literally starting training for my first marathon in October, i'm on week 5.  Last week on thursday, i did my long run of 9 miles early, knowing that i was likely to start feeling bad soon (my whole office out with the covid) and i was right.  friday, i started coughing and getting the body fatigue.  I rested friday, rested saturday, and felt better bodily on sunday.. so i went running sunday, but was hit HARD and 3 miles was a chore to make.  


I rested again monday, and then tuesday tried running outside in the heat.... 3 miles again, but was met with a triple whammy of 1) The heat and humidity, 2) Onset of fatigue early and 3) Trying a new water backpack...  


Wednesday I just decided to run on my treadmill, made 4 miles and felt mostly fine.  Minimal fatigue after running, felt great, but thursday I woke up fatigued again.  I took thursday and am taking today off of running completely.  But I don't want to miss my long runs.... I have almost 0 base fitness to fall back on when training, and i need to build up the endurance.  Will running the 10 miles tomorrow morning be counter-productive?  am I setting myself up for a bigger failure if I run rather than just taking the day off and possibly making up for it later?  I am not sure what to do.  This is a big goal for me and I don't want to be set back and miss the race date. Any help would be great.  thanks.",4,0.75,1,marathons
165,1657236995.0,Kindly asking for your opinion on recovery after injury,"Dear Runners,   


I am writing this to kindly ask for your opinions on dealing with injury and specifically how to start carefully with training again without risking further injury.  

**Injury/Specifics:**

* In 2015, I ruptured part of my achilles tendon. Back then it took 24 months to properly heal. it was really bad. The injury came from competing in sports dancing competitions not from running. I did not have any problems ever since it healed and been running 1-3 half-marathons a year. 
* I ramped up my training too fast 10 days ago and after a 17k run up and down the hills, **part of that scar tissue from the old injury got hurt.** 
* It is nothing like it was back then, not even close in severity. However, I could not use the leg for a day, had pain walking for 1 week gradually getting better. 
* Right now, I only feel a bit of irritation. When I walk around a lot (travelling for work) it is worse in the evening. However, at this pace, I think within a couple days I will be able to walk again without any pain. Especially the last two day were great prorgess of healing.   


\--> I stopped running immediately when I injured myself because I recognized the exact location from the old injuty. I have not run since for the last 10 days. **With the injury getting better, I am wondering what the best way would be to carefully start training again without risking injury. Any advise on this highly welcome!**  


**Context / Training:** 

* I ran a lot last year but stopped early in the year after a snake bite in my other leg; started again in March (see below).
* I run every third day.
* I ran in total each month (please dont laugh)
   * March: 15 km
   * April: 26 km
   * May: 78 km
   * June: 115 km (until injury)
   * July: 0 km (injuty)  


**2022 Running Goals:**

* October 30ths: first ever marathon (if I have to cancel now so be it)
* Beginning September: Half-Marathon
* End of August: Half-Marathon

I am happy to change these running goals. I want to be healthy and be able to run long-term.",2,1.0,0,marathons
166,1657211086.0,Chiyo Yamauchi Prepares for the 2022 Brooklyn Half | adidas Running,,0,0.33,0,marathons
167,1656861167.0,Salt?,"Hey guys- does anyone ingest salt during long runs? If so, what kind and is there a solid form that’s better than others?",4,1.0,5,marathons
168,1656082039.0,Running Headphones,"I currently run with 2nd gen AirPods. I really like them because they are comfortable, stay in my ears during runs and yoga, and work well with my Apple Watch. I also like that I can run with just one earbud in. They are loosing sound power so I might have to get new headphones soon. What does everyone use while they are training?",3,1.0,7,marathons
169,1655939971.0,Which underwear for marathon?,"Profane but serious question: What kind of underwear do you guys recommend for long runs (up to marathon distance)?

Context: 

* Im a male runner and as I am getting into longer and longer runs now I experience some problems with my running gear. 
* I have been wearing normal male tights underwear which are a mix of cotton and elastic fibers. However, as those get sweaty it creates friction resulting in my skin getting irritated.
* I wear tights on top of the underwear and dont want to change that. Wearing loser running pants leads to friction between the skin of my inner thights and they get wound during longer runs. 

Thank you!",1,1.0,10,marathons
170,1655686675.0,Marathon Train and Build booty?,Hi all! I was training for a marathon and noticed significant loss of booty. Anyone know of any training programs that allow you both endurance run and a great looking gluteus Maximus?,0,0.5,4,marathons
171,1655680008.0,Looking to Transfer Twin Cities Marathon Registration.,"I cant make it out to Twin Cities for the marathon on October 3 2022 like originally planned. I'm looking to find someone who is interested in running the race who i can transfer my registration to. 

Cost is now up to $170 for the race, I'm looking to re-coop what i spent which is $120. Please share and/or let me know if you are interested!",1,1.0,0,marathons
172,1655191562.0,Any advice for a beginner who wants to strt training for a marathon?,,3,1.0,1,marathons
173,1654998415.0,when to start exercise after covid?,"26y/o 
first say sorry, because i'm not english user, the expression may be not good.

It's now day 3 since i was covid positive

I regular training long distance run every day, under average heart rate about 160-170, for 30 minutes to 1 hour.
and also with weight training regularly.

I want to consult when did you start regular training after covid diagnosed?

I had mild to moderate symptoms, I want to restart training but worry if it will exacerbate the symptoms, want to know your experience.

thank a lot!",3,0.81,1,marathons
174,1654615590.0,"First time marathoner, training for a 5k; tips?","I know 5ks are basically nothing, but I’ve never been a runner. I am admittedly a couch potato, but I want to attempt and finish a 5k, even walking, and hopefully do a 10k one day, but that’s a long term goal. I want to do this for myself, but to also show my kids that they can do anything they set their minds to. I’ve found a 7 week program for a 5k, and there’s a pond behind my house, one lap around it is exactly one mile. So I’ve got a plan to alternate walking two laps one day, and walking/jogging one lap the next. I also do some yoga stretches targeted toward my legs and lower body once I’m home, to help with stiffness. I’m still early; only day 4 of seven weeks, but I’m determined to do this. Are there any tips or things I should keep in mind while training?",3,1.0,5,marathons
175,1654443300.0,Half Training plan,"My current plan is tempo runs at/near what I think is my lactic threshold 2x a week (30mins each), 1x full body weight training, 1x run specific weight training, 1x short easy run mid week ( half the distance of the long run) and the long easy run on the weekend.  The goal is to build strength and speed.  Thankfully the area I run in has plenty of hills, small and large.  What other best practices can I add in?",3,1.0,0,marathons
176,1653867060.0,Running through the wall,"What’s up guys? 
Just trying to get some suggestions from more experienced marathoners. I’m a dude who typically runs 30-35 miles a week. Mostly “easy” runs. 8:30-9:30 min/mi for those easy runs. 
I’ve been doing a marathon prep for the last 8 weeks which I peaked at 55 miles and was feeling pretty good to be able to run  3:30 marathon. Well, at exactly mile 20 that plan changed. I was holding a pretty comfortable 8:10 pace up until that point and then I just couldn’t hold that pace. Ended up coming in at 3:58. 

What are some adjustments you guys have made from race to race? 
Thanks",2,0.75,8,marathons
177,1653376810.0,I have the flu. I have a question.,"If I miss a weeks running, am I screwed?

Background: running a half marathon in October. 

Been ramping up running by 5km a week. 

So I'm at 25km weekly, 4 x 6.2km runs. 

I'm due to go up to 30km a week in 5 data but have contracted genuine flu (aches fever etc).

Am I stuffed or u should bounce back?",1,1.0,3,marathons
178,1653343480.0,Training plan that incorporates drills?,"Aloha!  I have done a few marathons but never with much of a time goal before. 

I’m training now for one in late September and was planning on following Hal Higdon as far as mileage goes but would like to incorporate various drills as well. Is there a plan that has drills programmed into it or is it something I need to finagle myself?  

I suspect I don’t have the knowledge base for trying to adapt this myself…",2,1.0,0,marathons
179,1653127314.0,Need advice / peace of mind ahead of first time Marathon Training,"Bit of background: I have a good base fitness despite some health issues this year inc. recent bout of Covid. I run on average every other day between 6-12km and have done since I started running 1yr7mths ago. I also squeeze in 1 x half-marathon every month. My longest distance is 30km twice but that was approx. a year or so ago. 

The issue: I have my first ever marathon lined up end of September with my Hal Higdon Novice 2 training plan scheduled to start this coming week. However, I am on holiday for roughly two weeks towards the end of next week which will leave me with little to no opportunity to run. 

- What would you do in my situation? Would you start the training plan from scratch upon return and catch up for lost time?

- Do you think this could be an issue? 

- I am also aiming for a 3:40-4hr finish, would this be the right training plan for me?

Any advice/further tips would be much appreciated. I know training through the summer is going to be challenging!",3,1.0,7,marathons
180,1653081675.0,how close is under 2 hours to be cracked,the record is 2 hours 1 minute and 39 seconds back in 2018...its been 4 years and no one has got closer than that to cracking it?,2,0.75,2,marathons
181,1652900229.0,2022 TCS New York City Marathon Charity Bibs Available," Hello,

If anyone in this sub wants to run the NYC Marathon but did not secure a spot (or knows of anyone in this situation), I work for a nonprofit that has three charity bibs available.

Anyone interested in securing a bib through our 501c3 nonprofit is required to raise $3,000 in donations for the charity (and pay the difference themselves if they don't raise the $3,000)

To avoid violating any group rules, I will not mention the name of the nonprofit in this post but our organization serves visually impaired individuals with a rare retinal disorder for which there is no treatment or cure. Please DM me if you are interested and I'm glad to provide all the details you need/want

Thanks!",6,0.88,8,marathons
182,1652366324.0,Running my first marathon with Peloton’s Road to Your 26.2!,"Has anyone here taken [the course](https://www.workoutreviews.org/classes/peloton/road-to-26-2/week-1-journal/), and if so, what advice do you have?",4,0.84,1,marathons
183,1651769764.0,Where should I begin my marathon training?,"I've been a couch for quite some time. I used to sprint in HS but lost touch with any form of running. I thoroughly enjoy running but couldn't get myself to do it. I want to start training for a marathon but have no idea where to begin. Do I need to go to a gym? or can I build my stamina and speed on my own without equipments. I'm a little confused here, could need some help :)",5,1.0,2,marathons
184,1651579582.0,"Marathoners, What Made You Decide to Run Marathons?",,4,1.0,3,marathons
185,1651439365.0,"Hi Friends,",Any recommendations on taking 500mg of a pain killer before a half? Tylenol seems to be the best recommended. Is this dose low enough to be safe?,2,1.0,5,marathons
186,1651410918.0,Debut Half Marathon: Illinois Race Weekend Half Marathon,,1,1.0,0,marathons
187,1651358222.0,More than 26.2: The Indigenous Women Who Ran Boston and the Resilience It Took to Get There,,4,0.75,1,marathons
188,1651077509.0,"Vietnamese runners win big at Da Nang Int’l Marathon 'Over 9,000 foreign runners from nearly 70 countries and territories worldwide competed at seven editions of the marathon.' | Culture - Sports",,2,0.67,0,marathons
189,1650991761.0,The Everest Marathon: Conquer the Mountain Within Yourself in The World's Toughest High Altitude Race.,,4,1.0,0,marathons
190,1650914125.0,Running Economy in check?,"We all aim to optimize economy, but how can we tell that we're doing it right? I'm curious so hear what measures you use as monitors for economy.  Please share!

According to Dr. Matt Jordan - Jumping matters! Check out this excerpt from a webinar on why jumps can be a great when looking at readiness with RSI.

[https://youtu.be/dbe6bEFpNTw](https://youtu.be/dbe6bEFpNTw)",0,0.4,0,marathons
191,1650671860.0,Complete Novice looking for help to find a plan/running shoes,"Hello👋🏻 I (M21) am a complete novice runner who has signed himself up for a marathon next April (2023). I’m doing this as a challenge to prove to myself I am mentally capable of doing something like this however I’m not sure where to start.

Can anyone point me in the direction of good marathon plans that fit the time frame of 10 months training or less. If there are any or sources or tips people would be willing to share it would mean a lot.

Lastly I’m also in the market for a decent pair of running shoes so any recommendations would be much appreciated.

Thanks in advance and hope your all doing well :)",1,1.0,4,marathons
192,1650142134.0,Vegetarian nutrition for marathon training? Marathon/ Marathon nutrition books,Thrilled to have gotten a lottery spot at the NYC marathon. I recently read Murakami what i talk about when i talk about running and LOVED it. Highly recommend. But am looking for some more similar running/marathon books as well as some vegetarian nutrition books for guidance on how to properly fuel for training. Any recommendations are greatly appreciated,4,1.0,4,marathons
193,1649964713.0,Maui Marathon 4/24 - Any experienced advice?,"Hi folks, I'm signed up for my first marathon on 4/24, the Maui Marathon. Does anyone have any advice or wisdom on how that one is set up? Are there waves or groups for starting? What kind of water/gatorade/gu etc do they hand out? How does the humidity hit after 20 miles? Thanks!",2,1.0,3,marathons
194,1649940744.0,"26.2 question Weights: Nearly finished with training for my 4th marathon. I’ve been pretty active with weights throughout the entire schedule. Generally speaking, each week I spend 2 days on upper body (on easy days) and 1 day on legs (speed work days). How far before race should I quit the weights?",,5,1.0,0,marathons
195,1649802837.0,Mountains 2 Beach Marathon Changing Date 50 Days Out and Not Offering Refunds,,7,0.9,14,marathons
196,1649709606.0,Is there a service that emails when you can sign up for the world marathon majors?,I’d absolutely love to run in any one of them. The races seem so enjoyable with the huge crowds and everything! I’d want to try to get a lottery bib in the marathon majors that offer that but I’m not sure when I can put my name in? Is there a service/website that alerts you? Thanks so much!,5,0.78,0,marathons
197,1649249845.0,Running a Marathon After Being told i Would Never Walk Again,,8,0.9,2,marathons
198,1649193849.0,Advice about sports massages,"I’m running my first marathon in just over 6 weeks. I have a voucher for a sports clinic that I’m considering using before the race. Am I best to get a massage on a training day or on a rest day?

Any guidance is appreciated!",3,1.0,2,marathons
199,1649038682.0,Walking friendly marathons,"Hello! I’m trying to get more fit and have started walking regularly. I’m not in good shape and haven’t been as active as I should be. I recently looked at a book called “Marathons for Mortals” and while I don’t know that I could train to run a marathon, I do think maybe I could train to walk a marathon. I don’t know if I start now if I could prepare enough for the Honolulu Marathon this December. Honolulu sounds great and I’d obviously prefer not to travel so far but I love the fact that there’s no time limit. It seems all the marathons and 1/2 marathons I look at have a time limit that would not accommodate anything but a speedwalker. Does anyone know of any races other than Honolulu with a very generous time limit? Thanks!",1,0.67,13,marathons
