,created_utc,title,selftext,score,upvote_ratio,num_comments,subreddit
0,1686380593.0,"Just turned 18, what’s the best sites to fine marathons","All the websites I’ve tried to find seem old and aren’t up to date, what is your go to method to find marathons",1,0.6,9,marathons
1,1686166785.0,Support for ACS Fundraiser & Marathon advise,"I’m writing to ask for support in finishing my fundraiser goal with American Cancer Society, and to promote your brand on our social media platforms and race events leading up to the 2023 Long Beach Marathon.  
As a racing enthusiast, I told them I would be very interested in racing as a partner and help fundraise for their mission.  
With that being said, I am trying to get in contact with as many people as I can who can help me connect with others to accomplish our athletic and charitable goals; which we are now only $70 away.  
I will be aiming for an elite time in this event, to use the podium as another way to thank those willing to support our cause.  
Again, anything helps and would be greatly appreciated.  
[https://secure.acsevents.org/site/STR?fr\_id=105459&pg=personal&px=58576436](https://secure.acsevents.org/site/STR?fr_id=105459&pg=personal&px=58576436)  


Please let me know your thoughts,  
LTJG Joshua Sappington  
NIOC Hawaii  
7145016448  
YouTube: [https://youtube.com/user/JakeJoshTeam](https://youtube.com/user/JakeJoshTeam)  
Instagram: @Jsapproductions ",0,0.33,0,marathons
2,1686088145.0,Looking to run my first marathon. Need training advice.,"The longest I’ve ever ran was 10k in around 53 min this week (I know I could definitely run for much longer but I just haven’t had the chance). I’ve stopped going for regular runs probably a year ago (I mostly did a 3k jog and 10-15 30 second sprints every other day for a couple of months) 
I’m 17, I’d say above average fitness wise and I’ve been exercising my whole life.

I’m looking for advice from more experienced runners. How do I start? What training plan should I follow? Anything that you think I need.

I know I am very capable of finishing a marathon just need some advice. Thanks in advance.",1,1.0,1,marathons
3,1685950370.0,Berlin Marathon 2023 Registration,"Hi everyone.   
I just begin to run about 10 months ago, not a good runner, but trying to improve myself. I completed a half-marathon in April so I want to challenge myself in a full marathon.   
I'm trying to register for the Berlin Marathon in this year, cause I'm living in Germany, no other exception, also I want to have a medal to archive that I can do it.   
Not sure if I'm wrong, but it is extremely hard for me to find a tour to register for that. It is also my first to to register for a full-marathon, the previous marathon I joined was pretty easy (Leipzig Marathon 2023).   
Do you know anywhere I can register for the marathon? My budget is about 500-700 eur. I hope that could be enough. I'm afraid that all the room is already booked.",2,1.0,1,marathons
4,1685669771.0,"San Diego RnR, Realistic Expectations","This will be my first marathon in 8 years. I feel prepared “enough,” although still a bit nervous because:

1. I could’ve and should’ve trained more.
2. I did very little elevation training.

My longest training run (pictured) was one of my best training runs. This was two weeks ago yesterday. I’ve only done smaller 3-5 mile runs since, and I do feel rested.

Knowing this, and looking at my time and splits in the image… what is a realistic goal I should take to the starting line with me?",2,1.0,3,marathons
5,1685650334.0,"Not a runner, ran a sub 4 hour marathon with literally zero training.","Hi there, just thought I’d post this in a place where it may be useful for someone doing research on a similar attempt in the future. 

In short I (24M) have always been fairly fit, decided as a laugh to attempt a full marathon. Zero training, less a brief jog in my new running shoes in order to break them in about a week prior. I must admit I’m a valet attendant so my joints are probably by now used to the impact of sprinting across concrete car parks. 

Regardless I managed to get through it in under 4 hours, with some pretty interesting splits. Everything up to mile 18 was fine, after that my legs slowly turned to concrete. However I was still able to griz it out. I’m a fairly mentally robust person so it was more a battle of boredom for much of the race. 

Post race I was in a bad way, although I thought it was hilarious. Couldn’t walk but rather shuffled for about 3 days (not helped by my lack of any stretching). One toenail turned black a recently fell off, also suffered what seemed like really nasty flu symptoms for about 2 days post race. It took me about 4 weeks to be back to 100%. All in all it’s a funny memory and suffered no long term injury from the attempt. 

Whilst undoubtedly stupid to do so, in my opinion running a marathon without training is completely possible so long as you pertain a good level of ‘natural’ fitness and are mentally robust / stupid enough to try, just be prepared to be immobile for a few days afterwards.",0,0.3,4,marathons
6,1685565522.0,"*Update* Russ Cook Aka The Hardest Geezer is 40 days in, in his attempt to run the length of Africa",,5,0.86,0,marathons
7,1685522847.0,International Marathon group 🌍🏃🏻‍♀️🏃🏻🏃🏾‍♂️,"Hey there, fellow marathoners!

I want to invite you all to join my meet-up group called ""International Marathoners: We Run The World,"" where we share our passion for running and explore the world through marathons.

I started this group because I believe that running is not only a great way to stay healthy but also an incredible opportunity to travel and experience new cultures. And what better way to do that than by participating in marathons around the world with like-minded individuals?

This year, I have scheduled two amazing marathons that I'm sure you wouldn't want to miss. The first one is the biggest marathon in Central Asia - it's going to be one for the books! The second one is the OG Athens Authentic Marathon, where we'll get to run in the very footsteps of ancient Greek legends.

So, if you're looking to combine your love for marathons with travel and adventure, I highly recommend you join us! I promise it will be an experience of a lifetime. Let's run the world together!

Feel free to suggest me some ( outside the big six )

Check out International Marathoners: We Run the World on Meetup https://meetu.ps/c/53HyQ/TGTTv/a",3,1.0,0,marathons
8,1685222281.0,Question?,I am a 16 year old basketball athlete. i am very physically fit. I decided that i wanted to run a 3:45 marathon and i just did 6 miles at a 9:23 pace today with no problems at all and Never trained before. (could've kept going. just started pouring down rain.) how long of training until you think i could reach that goal.,3,1.0,2,marathons
9,1684763602.0,Throwing up after marathons - Looking for advices,"Hi everyone, 

So here's my problem : I ran the Paris marathon 1 year ago, it was quite hard but I managed to reach the end. About 30 mins after, I started throwing up and it went on and off for a few hours. 
For context, I used one gel per hours (for 4h40) + 2 caffein gels. I did not eat or drink anything else apart from water and I did try 2 or 3 times my gels on long runs before the marathon. 

Yesterday I ran another marathon and it happened again. This time I used a glucid + salt isotonic drink and 2 energy bars which I also tested before the event without any warning signs. 
Around 25k I was really disgusted by the taste of my drink and I stopped using it. At 35k I was completely in hypoglycemia and I had to forfeit and walk to the closest fueling station. I took 2 gels (that I took in case of emergency) to avoid fainting. Then, you guessed it, about 30 mins after stopping, I vomited as well. 

So here is my question : is there something wrong with my nutrition plan that makes me sick? Has anybody encountered such situation and what was the solution ? Should I check with my MD for a potential gastric condition ?

Tl;Dr : I threw up after 2 marathons, with different nutrition plan, what's going on?",0,0.5,6,marathons
10,1684628464.0,"Montreal, Quebec City, Toronto, Ottawa: which city has the most scenic course?",,2,1.0,1,marathons
11,1684422352.0,Amsterdam Marathon,"Hello Marathoners!

I have recently completed my first-ever marathon in Copenhagen and feel the addiction to completing more. I have signed up for Amsterdam Marathon and will likely travel there alone from Denmark, so I will ask if anyone here has any suggestions or tips for marathon traveling by yourself. It's not that I haven't traveled by myself before, I am just wondering if there is something, in particular, you should look out for. 

Also, if anyone here is planning on doing the same thing or, too, is running the marathon and would like to meet - Please contact me :)",5,0.86,5,marathons
12,1684411643.0,Two Weeks til 26.2,"April 16 I completed my longest run (16mi) but suffered a minor knee injury around mile 10.  (Long unnecessary story that includes some pretty rude bike riders). 

Rest and rehab for the last 4 weeks and finally got clearance to start running/training again this last week. 

Feeling really discouraged after all of the training I’ve done to get sidelined so close to race day. 

What is the best plan of attack in your opinion over the next two weeks to feel a little more prepared to complete the marathon? Or should I step back and transfer into the half?",5,1.0,0,marathons
13,1683902618.0,London Marathon,"Special announcement

I have made all the images as  social media size free of charge via my website www.imagesfromaroundthworld.com

Please remember to tag me in any posts

#LondonMarathon2023 #marathon #runner #runchat #runningchat #socialmedia #free #photos 


#marathontraining #feedthelight #londonmarathon2023 #wheelchair #wheelchairlife #wheelie #amazing #stamina #guts #lifechanging #fun #active",11,1.0,0,marathons
14,1683749846.0,Fuel for Marathons/Long Runs,"A little bit of background before asking the overarching question:

I just got out of a 20-week training block where I never really felt soreness or extreme fatigue from running, and never questioned my fuel intake during a run. I was training for a sub-3 marathon, and was hoping to finish in 2:55:00. At week 13 of training, I ran a 1:22:35 half, and while I felt winded, I thought the fuel during the race was not an issue. When completing the marathon this past weekend, I finished in 3:22:30, largely due to passing/blacking out just after mile 20 from what I’ve concluded was a lack of fuel/energy. I have the fitness to be able to run a marathon sub-3, which is why I think fueling was the main issue in not meeting the goal (side note: ran in AplhaFlys). 

I am going to start another training block fairly soon in hopes of qualifying for BM 2024. During hard training runs, long runs, and races, I only used the regular GU Energy Gels (1.1 oz). I regularly rotated between drinking water and a drink with electrolytes. Leading up to the race, I had ~750g of carbs each day over the prior two days. The morning of the race I had a full Gatorade, a bagel with light PB, banana and honey. During the race, I consumed a gel every 3.5 miles and took them in with liquids for highest efficiency.  

Based on what was described above, what could be some reasons that this fuel may not have been effective? Do people feel as though there are gels that work better than others? Could this be a bigger issue other than fueling? Looking for any/all recommendations.",1,0.67,8,marathons
15,1683126852.0,2023 Grandma’s Marathon Transfer for Sale,"I have a 2023 Grandma’s Marathon entry I am willing to transfer. Unfortunately, something came up and I will not be able to make it up north for Race weekend.

From my understanding, whoever the entry is transferred to will pay a $30 fee to RaceRoster. I’d like to get back some of the $150 entry fee back but I am open to negotiations. Thanks!",1,0.67,0,marathons
16,1683036950.0,Philly 2023 The Broad street Run,,1,0.67,0,marathons
17,1682953791.0,World’s Oldest Ultramarathon Runner,"""Japanese monks of Mount Hiei who run-walk 1,000 marathons in 1,000 days in order to attain enlightenment...Sometimes a racer would double over with stomach pain or turn their head sideways and vomit over their shoulder while they ran. Some experienced a temporary loss of vision as their corneas swelled from a buildup of fluid. Then there were those who would end up so fatigued on the trail that they would begin to hallucinate...

After age sixty, the performance declines become more drastic as the human stride shortens and ankle power decreases...Sikh road runner Fauja Singh, who in 2011, at the age of 100, became the first centenarian to complete an organized marathon...simple diet of phulka, dal, green vegetables, yogurt, and milk. Compared to Dag, Singh treated his body like a temple. “I take lots of water and tea with ginger.” https://thewalrus.ca/worlds-oldest-ultramarathon-runner/",7,0.9,0,marathons
18,1682825555.0,Fundraising,"What are some fundraising ideas for a charity bib?

I signed up for Goofy at Disney with Team RWB. 

I'm doing a panda express fundraiser (Apply code **914898** in the Fundraiser Code box during online checkout or via App for food on May 12, 2023 and 28% of sales will be donated to: Team Red White and Blue: enrich the lives of America's veterans)

I'm looking at $5 Below, chickfila, etc. 

I don't have a very wealthy friend & family base, so posting on my own social media only does so much. It's also only me, so big events aren't really an option.",2,1.0,1,marathons
19,1682527808.0,Congratulations to Glenique Frank!,"Her performance in the London marathon was spectacular. Way to represent girl power! And for her to win this race at 52 also. Truly remarkable, and an inspiration to women runners everywhere",2,0.55,4,marathons
20,1682452825.0,London Marathon last sunday,"I photographed the London marathon and you can see the amazing people of the race, so much energy there.

www.imagesfromaroundtheworld.com

Yes please share if you want

Enjoy

Michael Crawford Hick",4,1.0,0,marathons
21,1682451873.0,Charity for 2024 London Marathon,I would like to run the 2024 London Marathon but am not fast enough to qualify. I applied for a ballot spot but guess the chances to get picked are slim. Any tips for a charity that is ok with the £2000 fundraising minimum?,1,1.0,1,marathons
22,1682396750.0,Advice for improving my marathon time,"I finished my first marathon in Seoul, South Korea in February with a time of 4:12:47. It is an ok time, but I really want to get under 4 hours. Eventually I’d really like to try to qualify for Boston, but I don’t know if that’s a realistic goal for me.

I’m a 28 year old woman, and I’ve been running daily since I was 18 or 19, but not competitively. I’m mainly healthy other than some mild exercise-induced asthma and mild knee instability because I have flat feet (but I’ve never been seriously injured).

I’m planning to run the Houston Marathon in January 2024. Right now I’m using the Hal Higdon app. I’m on his base-training plan until September when I’ll start his Advanced 1 training plan. I’ve also signed up to run the Houston Half in October as part of my training.

Taking all of this into consideration, what advice do you as other runners have for me in terms of getting faster and better?I’d like to finish in 3:50 mins or less this time. I think it’s doable because I took it pretty easy and just did a basic Peloton training plan for my first race. My goal was just to finish. I think if I really apply myself I can get faster.

What do you recommend in terms of cross-training (usually I just do ashtanga yoga)?
Are there any apps I should download or books I should invest in? (Is training peaks worth it if I have the Run with Hal app?)
What are some important habits I should develop in order to reach my goal?

Any advice is welcome! Thank you so much!!",4,0.84,5,marathons
23,1682325250.0,Skin peeled off,"Hi guys

Ran my first Marathon yesterday. Unfortunately it was raining heavily at the beginning, so my socks were very wet. Had blisters, they popped, and then another set of blisters which popped again.

Now on one foot arch, the skin has completely peeled away, leaving just this red thing very exposed. 

How should I treat this? Or simply will it heal on its own?",3,1.0,1,marathons
24,1681814043.0,my first sub 3h marathon ♥️,"It has been the 19th of March, in Rome (Italy). It took me 2h59'36"".

I know, is just a bunch of seconds under the 3 hours but it still means the world to me♥️

This was my second marathon overall (first 3he18' back in November) and I really haven't thought this could be possible to achieve in such short time!

I have trained with a running coach so I guess I did everything right, but still it was hard for me to believe I could run a sub 3h marathon!

I guess I'll be pushing even more and I am considering to participate the Valencia Marathon (Spain, EU) in December ♥️  let's see what happens!

ps: the nicest thing is that my coach is more for a sustainable running method, so I finished the marathon feeling very good all considered. 
I walked 10km more right after the race, and I went for an easy 10km run the day after!

it is crazy what the human body can do 🍀",40,0.97,0,marathons
25,1681804407.0,Obese to Sub 3-Hour Marathon. Can it be done?," Hi reddit, I have absolutely no experience running at all. Not only that, I am overweight (28M 225lbs) and am unfit to the point that going up some stairs leaves me out of breath.

I realise this may not be the right question to ask and I should think smaller, BUT I wanted to put this question to the experienced runners on here: IF you had a gun to your head, and had to devise a training program to get me from where I'm at now to running a sub 3 hour marathon, what would it be? Is it even possible or have I left it too late?

This is very interesting to me and I am looking forward to seeing what you high level/long-time runners have to say in term of plans and training etc.

I massively apologise if this breaks any rules regarding posts, but instead of looking it as ""beginner asks for advice"" think of it more as a thought experiment, ie is this possible, and if so how?",6,0.81,8,marathons
26,1681765413.0,Can you run everyday and still get faster?," When it comes to developing a training plan to improve running fitness, there always seems to be at a day off booked every once or twice a week? Which makes me wonder if there are any professional runners or training plans that can build fitness and still lower fatigue with no days off?",2,0.75,3,marathons
27,1681738775.0,How to Improve First Marathon Time (2:53:07),"Hi everyone, new to the Reddit scene and really just looking for any advice, comments, tips, and help to improve on my running abilities. 

I ran my first ever marathon in Chicago 2022. I started training and stuck to a regime fairly early on but my training wasn’t super focused or consistent.  About midway through I found myself burnt out and lacking motivatio. In the month leading up to the race I only ran a total of 8 miles and went in wildly unprepared and thus had zero expectations. 

I ended up running 2:53:07 and shocked myself and really everyone around me. 

I’m unsure about running another marathon but when I tell other runners about my time and my experience they push for me to attempt another one. 

So I have a lot of questions…

Is my time really that good? 
Should I be pursuing running a marathon with more training to improve on that time?
Mainly I’m just feeling lost in the running community, where does that time stack up against other marathon runners my age, is it even possible for me to be better, what types of goals could I set for myself moving forward. 

Any and all thoughts are welcome, happen to expound about my experience reince in more depth and detail, really just looking to discuss running further with more experienced and knowledgeable people.",0,0.33,1,marathons
28,1681737747.0,BOSTON MARATHON LIVESTREAM - ELIUD KIPCHOGE FREE FR,,3,0.81,2,marathons
29,1681682741.0,Rio de Janeiro Marathon 2023,Is anyone selling their spot in the Rio marathon on June 11th?,1,1.0,0,marathons
30,1681593447.0,San Diego Rock 'N Roll Marathon 2023,"Anyone else running?  


This is far from my first marathon. I've run about a dozen. However, all of 'em were between 2012-2014. I haven't done much distance running since moving to the West Coast, and the 13 miles I logged last Sunday is the longest distance I've done in many many years.  


Question: What is the best plan of attack, given that I have about six weeks left to train and my longest distance is half of what I need to pull off? I'm thinking of not tapering, and using the marathon itself as if it is my last long run before tapering.  


Part of me thinks that because I've run so many I'll still ""be fine,"" I know what I'm in for after all. But I'm open to opinions.",3,0.81,4,marathons
31,1681486838.0,Do I have good long distance running genes?," So for reference, I am a 25 year old male, I like to run for fun on the treadmill, outside, and even play lots of basketball. My main focus is body building as I am in the mesomorph muscular body type, 5'10 inches 185 pounds.

I casually ran a half marathon last October, finishing in 1:14:44 sec, with a mph time of 5:42. This was my first ever half marathon, and I breezed through it. I felt like I was actually running at a slow and steady pace, so when I finished I was so shocked. I wasn't even running as fast as I wanted because it was just my testing waters run.

Anyways, I am running a half marathon in NYC in a week and I kind of slimed down. But how great do you think is my running potential if I keep running and maybe even lose some of my muscles to get even faster? Obviously and (no disrespect) a lot of long distance runners are very skinny, and I don't have that advantage.

Any tips or advice would be appreciated! thank you!",0,0.13,1,marathons
32,1681462649.0,1987 Boston Marathon | ESPN Coverage w/ Commercials,,2,1.0,0,marathons
33,1681457234.0,Jungfrau Marathon entry sell,"I purchased an entry to the Jungfrau Marathon 2023, but I won't be able to make it anymore. They told me that I can sell my entry to another runner. Is anyone interested? Thanks!",2,1.0,0,marathons
34,1681095465.0,Marathon next week…,"Hello friends,

I’m training to run a marathon next week and realized my shoes aren’t great for it as I don’t run often.(ASICS gel nimbus 22). I don’t think they would injure me but I’m wondering whether it would be worth buying a new pair made for long distances just 6 days before the race.

I’m concerned I won’t have enough time to break them in or somehow my feet wouldn’t be used to them.

What do y’all think? Are there any specific ones you would recommend?

(6’3” M 175lbs, narrow footed, regular arch)

Edit: just want to add that I’m in peak physical shape and have completed ultra marathons with no injury on trails. Just want to make sure I am ready to hit the asphalt and am wondering whether it would be worth switching shoes with just a week to go.",0,0.5,18,marathons
35,1680928869.0,What watch do you wear?,"My Garmin 235 broke years ago and I bought an apple watch, getting geared up for half marathon training, then a marathon after that when I'm in better shape. 

I like my apple watch but it doesn't give me as much data as I'd like to have, any advice?",1,1.0,5,marathons
36,1680748239.0,Joint pain after my first marathon. What’s the best way to recover and what time frame should I expect?,"I ran my first marathon 2.5 weeks ago and the joints in my knees are still crackling/painful. I’m 39 yo and in good shape, although my runs are more typically 7-14 miles, so 26.2 felt like a lot.  I mostly trained trail and the marathon was mostly paved. I’m wondering if the knee issue is normal, how long to expect my knees to get back to normal, and how to take best care of my joints so that they heal. How long should I delay running again?",5,1.0,6,marathons
37,1680661795.0,Caffeine Gum During Races,"Last year I did my first marathon and am training for another this fall. I’ve tried a lot of the caffeine gums out there on the market and I’m curious what the community thinks about these. I’ve used Run Gum, Rev Gum, and Viter Energy. They are all pretty similar taste wise…some better than others. I’m just a big fan of the immediate caffeine burst late in the run. Anyone else out there use these or suggest some that may be better?",2,0.76,5,marathons
